{
  "adapter_id": "MIREYE_UNIFIED_CONTEXT_ADAPTER",
  "adapter_version": "0.1.0",
  "authority": {
    "canonical_for_parcel_facts": false,
    "permitted_uses": [
      "POINT_QA",
      "FAST_CONTEXT",
      "CANDIDATE_DISCOVERY",
      "DILIGENCE_TRIGGER",
      "JURISDICTION_CONTEXT"
    ]
  },
  "context_id": "mireye_c72e64660961203d8d67dce3",
  "context_type": "POINT_HAZARD_CONTEXT",
  "factor_usage_refs": [
    {
      "context_id": "mireye_c72e64660961203d8d67dce3",
      "factor_id": "F08_WOODY_AND_SHRUB_VEGETATION_STRUCTURE",
      "field_id": "tree_canopy_pct",
      "use": "POINT_QA"
    }
  ],
  "fields": {
    "flood_zone": {
      "confidence": null,
      "dataset_vintage": null,
      "fetched_at": "2026-08-07T21:00:00+00:00",
      "field_id": "flood_zone",
      "notes": "NFHL unavailable",
      "raw_field_hash": "e67a45b50e1896dfb5861aa6109f78471e5da72caaafdf550fcda76fdacdcc91",
      "source": "FEMA_NFHL",
      "source_url": "https://www.fema.gov/national-flood-hazard-layer",
      "ttl_seconds": 2592000,
      "unit": null,
      "value": null
    },
    "ndvi_current": {
      "confidence": "low",
      "dataset_vintage": "fixture",
      "fetched_at": "2026-08-07T21:00:00+00:00",
      "field_id": "ndvi_current",
      "notes": null,
      "raw_field_hash": "ae3f7b902b06e9c78aec13033318e031ec38403ea56447753db86a5d1006d939",
      "source": "SATELLITE_NDVI",
      "source_url": "https://example.invalid/ndvi",
      "ttl_seconds": 86400,
      "unit": null,
      "value": 0.31
    },
    "tree_canopy_pct": {
      "confidence": "medium",
      "dataset_vintage": "fixture",
      "fetched_at": "2026-08-07T21:00:00+00:00",
      "field_id": "tree_canopy_pct",
      "notes": null,
      "raw_field_hash": "614912548c2e32ca6f6253d29f8f4d12c1838877e3d1958bde7a42846c713e8b",
      "source": "USFS_TCC",
      "source_url": "https://data.fs.usda.gov/geodata/rastergateway/treecanopycover/",
      "ttl_seconds": 31536000,
      "unit": "percent",
      "value": 2.5
    },
    "within_floodplain_polygon": {
      "confidence": "medium",
      "dataset_vintage": "NFHL fixture",
      "fetched_at": "2026-08-07T21:00:00+00:00",
      "field_id": "within_floodplain_polygon",
      "notes": null,
      "raw_field_hash": "ed468a0e8aa9879151737069844958bb4b43dd1075acd879522d214e6cb78747",
      "source": "FEMA_NFHL",
      "source_url": "https://www.fema.gov/national-flood-hazard-layer",
      "ttl_seconds": 2592000,
      "unit": null,
      "value": false
    }
  },
  "limitations": [
    "canonical_for_parcel_facts=false",
    "point_or_diligence_context_only",
    "do_not_average_with_parcel_land_facts",
    "do_not_promote_to_factor_land_facts",
    "legal_title_not_verified",
    "zoning_legality_not_confirmed"
  ],
  "location": {
    "lat": 40.825,
    "lng": -104.7625,
    "parcel_geometry_hash": "fixture_geom_hash_cper_001",
    "point_role": "PARCEL_CENTROID_QA",
    "spatial_semantics": "POINT"
  },
  "partial_failures": [
    {
      "error_code": "FEMA_UNAVAILABLE",
      "field_id": "flood_zone",
      "message": "NFHL unavailable",
      "normalized_effect": "UNKNOWN",
      "raw_failure_hash": "a9990df9dcb725aa3ac9d8686c748604e4a339a40da71b0aecdd5303dc57b877",
      "retryable": true,
      "source": "FEMA_NFHL"
    }
  ],
  "provenance": {
    "adapter_version": "0.1.0",
    "api_base_url": "https://api.mireye.com",
    "api_or_catalog_version": "0.14.0",
    "raw_artifact_reference": "test-data/mireye-normalized/raw/point_hazard_fema_partial.json",
    "raw_response_hash": "c08fe72b52bef4a346a2f8b7dbf7ccc1f6bba205f71505e22c594ad400c8cd52",
    "request_hash": "abce270593f8a6469c34b75f97f89584f6f911a91cc38f5aef99368f4829560f"
  },
  "request": {
    "endpoint": "/v1/fetch",
    "explicitly_requested_fields": [
      "tree_canopy_pct",
      "ndvi_current"
    ],
    "preset": "flood_risk",
    "request_hash": "abce270593f8a6469c34b75f97f89584f6f911a91cc38f5aef99368f4829560f",
    "requested_location": {
      "lat": 40.825,
      "lng": -104.7625
    }
  },
  "response_status": {
    "fetched_at": "2026-08-07T21:00:00+00:00",
    "status": "PARTIAL"
  }
}
